id,slug,title,category,subCategory,difficulty,isPremium,tags
pat-001,patch-sharepoint-people-picker-power-apps,"Patch a SharePoint people picker field from Power Apps","Power Apps","People picker fields",Intermediate,false,"Patch|People Picker|Combo Box|Claims"
pat-002,patch-sharepoint-choice-field,"Patch a SharePoint choice field","Power Apps","Choice fields",Beginner,false,"Patch|Choice|Status"
pat-003,patch-sharepoint-lookup-field,"Patch a SharePoint lookup field","Power Apps","Lookup fields",Intermediate,false,"Lookup|Patch|Related Records"
pat-004,save-gallery-rows-json-multiline-text,"Save gallery rows as JSON in a multiline text field","Power Apps","JSON save/load patterns",Advanced,true,"JSON|Gallery|Collections|Multiline Text"
pat-005,parse-json-sharepoint-power-apps-collection,"Parse JSON from SharePoint back into a Power Apps collection","Power Apps","JSON save/load patterns",Advanced,true,"ParseJSON|Collections|Gallery"
pat-006,submit-multiple-power-apps-forms,"Submit multiple Power Apps forms together","Power Apps","Multi-form submit",Intermediate,false,"Forms|SubmitForm|Validation"
pat-007,refresh-selected-request-after-patch,"Refresh selectedRequest after Patch","Power Apps","Refresh and selected record patterns",Beginner,false,"Patch|Refresh|Selected Record"
pat-008,default-selected-items-modern-combo-boxes,"Default selected items for modern combo boxes","Power Apps","Modern combo box defaults",Intermediate,false,"Modern Controls|Combo Box|Defaults"
pat-009,role-based-button-visibility-sharepoint-security-list,"Role-based button visibility using a SharePoint security list","Power Apps","Role-based visibility",Intermediate,true,"Security|Roles|Visibility"
pat-010,avoid-delegation-warnings-sharepoint-filters,"Avoid delegation warnings with SharePoint filters","Power Apps","Delegation-safe filtering",Intermediate,false,"Delegation|Filter|Large Lists"
pat-011,patch-request-status-choice-field,"Patch Request Status as a choice field","Power Apps","Choice fields",Beginner,false,"Status|Choice|Workflow"
pat-012,build-modal-edit-form,"Build a modal edit form","Power Apps","Modal forms",Beginner,false,"Modal|Edit Form|UX"
pat-013,calculate-totals-gallery-collection,"Calculate totals from a gallery collection","Power Apps","Collection management",Beginner,false,"Collections|Gallery|Totals"
pat-014,patch-collection-checklist-items,"Patch a collection of checklist items","Power Apps","Collection management",Intermediate,true,"Checklist|ForAll|Patch|Child List"
pat-015,recalculate-deliverable-completion-checklist-rows,"Recalculate deliverable completion from checklist rows","PMO / Project Management","Deliverables/checklists",Intermediate,true,"Checklist|Completion|PMO"
pat-016,format-sharepoint-hyperlink-field-json,"Format a SharePoint hyperlink field in list JSON","SharePoint","JSON column formatting",Beginner,false,"JSON Formatting|Hyperlink|Lists"
pat-017,power-automate-email-html-table,"Send a Power Automate email with an HTML table","Power Automate","Email formatting",Beginner,false,"Email|HTML Table|Flow"
pat-018,attach-sharepoint-list-attachments-email-power-automate,"Attach SharePoint list attachments to an email in Power Automate","Power Automate","Attachments",Intermediate,true,"Attachments|Email|Apply to Each"
pat-019,use-odata-filters-sharepoint-text-fields,"Use OData filters correctly with SharePoint text fields","Power Automate","OData filters",Intermediate,false,"OData|SharePoint|Get Items"
pat-020,build-pmo-gate-approval-lifecycle,"Build a PMO gate approval lifecycle","PMO / Project Management","Gate approvals",Advanced,true,"PMO|Approvals|Lifecycle|Governance"
pat-021,patch-sharepoint-multi-choice-field,"Patch a SharePoint multi-choice field","Power Apps","Choice fields",Intermediate,true,"Patch|Choice|Multi Select|Combo Box"
pat-022,patch-sharepoint-multi-person-field,"Patch a SharePoint multi-person field","Power Apps","People picker fields",Advanced,true,"Patch|People Picker|Multi Select|Claims"
pat-023,create-sharepoint-item-and-child-tasks,"Create a SharePoint item and child tasks from one submit","Power Apps","Multi-form submit",Advanced,true,"Patch|Child List|ForAll|Parent ID"
pat-024,soft-delete-sharepoint-items-power-apps,"Soft-delete SharePoint items from Power Apps","Power Apps","Error handling",Beginner,false,"Archive|Delete|Governance|Filter"
pat-025,power-apps-error-handling-iferror-patch,"Handle Patch errors with IfError","Power Apps","Error handling",Intermediate,false,"IfError|Patch|Notify|Validation"
pat-026,delegation-safe-date-range-filter,"Build a delegation-safe SharePoint date range filter","Power Apps","Date handling",Intermediate,false,"Delegation|Date|Filter|Large Lists"
pat-027,sharepoint-internal-name-safe-column-design,"Design SharePoint columns with stable internal names","SharePoint","Column naming/internal names",Beginner,false,"Internal Names|List Schema|Governance"
pat-028,sharepoint-list-schema-for-project-intake,"SharePoint list schema for project intake","SharePoint","List schema design",Intermediate,true,"List Schema|PMO|Intake|Governance"
pat-029,sharepoint-document-library-metadata-pattern,"Document library metadata pattern for project files","SharePoint","Document library patterns",Intermediate,false,"Document Library|Metadata|PMO|Governance"
pat-030,sharepoint-permissions-request-list-pattern,"SharePoint permissions pattern for request lists","SharePoint","Permissions and governance",Advanced,true,"Permissions|Governance|Roles|Security"
pat-031,power-automate-approval-with-sharepoint-status-sync,"Power Automate approval with SharePoint status sync","Power Automate","Approval workflows",Intermediate,false,"Approvals|Status|SharePoint|Flow"
pat-032,power-automate-parse-json-from-power-apps,"Parse JSON sent from Power Apps in Power Automate","Power Automate","Parse JSON",Advanced,true,"Parse JSON|Power Apps|Flow|Collections"
pat-033,power-automate-compose-date-formatting,"Format dates in Power Automate with Compose","Power Automate","Compose expressions",Beginner,false,"Compose|Date|Email|Expressions"
pat-034,power-automate-sharepoint-update-item-with-etag-awareness,"Update SharePoint items without overwriting important fields","Power Automate","SharePoint item updates",Intermediate,true,"Update Item|SharePoint|Governance"
pat-035,power-automate-try-catch-scope-error-handling,"Use Try/Catch scopes for Power Automate error handling","Power Automate","Error handling",Intermediate,false,"Error Handling|Scopes|Flow|Governance"
pat-036,pmo-status-report-health-rollup,"PMO status report health rollup","PMO / Project Management","Status reporting",Intermediate,false,"Status Reporting|PMO|Health|Executive Reporting"
pat-037,pmo-risk-issue-action-log-schema,"Risk, issue, and action log schema","PMO / Project Management","Risk and issue tracking",Intermediate,true,"Risks|Issues|Actions|Decisions|PMO"
pat-038,pmo-executive-summary-from-rough-notes,"Convert rough project notes into an executive summary","PMO / Project Management","Executive reporting",Beginner,false,"Executive Reporting|Status Reporting|Writing"
pat-039,pmo-decision-log-sharepoint-pattern,"Decision log pattern for SharePoint","PMO / Project Management","Deliverables/checklists",Beginner,false,"Decision Log|PMO|SharePoint|Governance"
pat-040,power-apps-form-mode-new-edit-view,"Control Power Apps form mode for new, edit, and view screens","Power Apps","Form mode handling",Beginner,false,"Forms|Form Mode|Edit Form|UX"
pat-041,power-apps-save-draft-submit-later,"Save draft and submit later in Power Apps","Power Apps","Form mode handling",Intermediate,false,"Draft|Submit|Status|Forms"
pat-042,power-apps-submit-button-disable-while-saving,"Disable submit buttons while saving","Power Apps","Error handling",Beginner,false,"Submit|Duplicate Prevention|UX|Patch"
pat-043,power-apps-gallery-inline-edit-save,"Inline edit and save gallery rows","Power Apps","Gallery editing",Intermediate,true,"Gallery|Inline Edit|Patch|Collections"
pat-044,power-apps-bulk-update-selected-gallery-items,"Bulk update selected gallery items","Power Apps","Gallery editing",Intermediate,true,"Bulk Update|Gallery|ForAll|Patch"
pat-045,power-apps-search-with-multiple-fields,"Search SharePoint with multiple fields in Power Apps","Power Apps","Delegation-safe filtering",Intermediate,false,"Search|Delegation|Filter|SharePoint"
pat-046,power-apps-cascading-dropdowns-sharepoint,"Cascading dropdowns from SharePoint lists","Power Apps","Lookup fields",Intermediate,false,"Dropdown|Lookup|Filter|Reference Data"
pat-047,power-apps-current-user-profile-cache,"Cache the current user's profile in Power Apps","Power Apps","Role-based visibility",Beginner,false,"User Profile|Roles|Performance|Office 365 Users"
pat-048,power-apps-empty-state-gallery,"Show a useful empty state for galleries","Power Apps","Gallery editing",Beginner,false,"Gallery|Empty State|UX|Filter"
pat-049,power-apps-optimistic-local-update-after-patch,"Optimistically update a local collection after Patch","Power Apps","Refresh and selected record patterns",Advanced,true,"Patch|Collections|Refresh|Performance"
pat-050,sharepoint-view-indexing-for-large-lists,"Index SharePoint columns for large list views","SharePoint","List schema design",Intermediate,false,"Large Lists|Indexes|Views|Governance"
pat-051,sharepoint-choice-taxonomy-governance,"Govern SharePoint choice values before apps depend on them","SharePoint","Permissions and governance",Beginner,false,"Choice|Governance|Reference Data|Reporting"
pat-052,sharepoint-json-status-pill-formatting,"Format SharePoint status values as color-coded pills","SharePoint","JSON column formatting",Beginner,false,"JSON Formatting|Status|Lists|UX"
pat-053,sharepoint-calculated-column-vs-power-apps-formula,"Choose between SharePoint calculated columns and Power Apps formulas","SharePoint","List schema design",Intermediate,true,"Calculated Columns|Power Apps|List Schema"
pat-054,sharepoint-lookup-vs-choice-design,"Choose lookup columns vs choice columns","SharePoint","List schema design",Intermediate,false,"Lookup|Choice|List Schema|Reference Data"
pat-055,sharepoint-site-navigation-for-business-apps,"SharePoint site navigation for business apps","SharePoint","Site navigation patterns",Beginner,false,"Navigation|SharePoint|UX|Governance"
pat-056,sharepoint-list-template-release-checklist,"SharePoint list release checklist","SharePoint","Permissions and governance",Intermediate,true,"Release Checklist|Governance|Permissions|Views"
pat-057,power-automate-trigger-condition-status-changed,"Run a flow only when status changes","Power Automate","Approval workflows",Intermediate,true,"Trigger Conditions|Status|Flow|SharePoint"
pat-058,power-automate-start-approval-from-power-apps,"Start an approval from a Power Apps button","Power Automate","Approval workflows",Advanced,true,"Approvals|Power Apps|Flow|Item ID"
pat-059,power-automate-html-email-button-link,"Add a button-style link to Power Automate emails","Power Automate","Email formatting",Beginner,false,"Email|HTML|Link|UX"
pat-060,power-automate-get-manager-approval-route,"Route approval to a user's manager","Power Automate","Approval workflows",Intermediate,false,"Approvals|Manager|Office 365 Users|Routing"
pat-061,power-automate-reminder-before-due-date,"Send reminders before a SharePoint due date","Power Automate","OData filters",Intermediate,false,"Reminder|Due Date|OData|Scheduled Flow"
pat-062,power-automate-create-planner-task-from-sharepoint,"Create a Planner task from a SharePoint item","Power Automate","SharePoint item updates",Intermediate,true,"Planner|Tasks|SharePoint|Flow"
pat-063,power-automate-document-flow-inventory,"Document a Power Automate flow inventory","Power Automate","Flow documentation",Beginner,false,"Flow Documentation|Governance|Inventory|Support"
pat-064,power-automate-avoid-infinite-update-loop,"Avoid infinite update loops in SharePoint flows","Power Automate","Error handling",Advanced,true,"Infinite Loop|Trigger Conditions|Update Item|Flow"
pat-065,pmo-intake-scoring-model,"PMO intake scoring model","PMO / Project Management","Intake requests",Intermediate,true,"Intake|Scoring|Prioritization|PMO"
pat-066,pmo-steering-committee-decision-pack,"Steering committee decision pack structure","PMO / Project Management","Executive reporting",Intermediate,false,"Steering Committee|Executive Reporting|Decisions|PMO"
pat-067,pmo-milestone-baseline-tracking,"Track baseline vs forecast milestone dates","PMO / Project Management","Status reporting",Intermediate,false,"Milestones|Schedule|Baseline|Reporting"
pat-068,pmo-risk-escalation-thresholds,"Define risk escalation thresholds","PMO / Project Management","Risk and issue tracking",Intermediate,true,"Risks|Escalation|Governance|PMO"
pat-069,pmo-action-item-owner-due-date-discipline,"Action item owner and due date discipline","PMO / Project Management","Risk and issue tracking",Beginner,false,"Actions|Owners|Due Date|PMO"
pat-070,pmo-weekly-report-email-template,"Weekly project status email template","PMO / Project Management","Status reporting",Beginner,false,"Status Reporting|Email|Executive Reporting|PMO"
pat-071,pmo-project-closeout-checklist,"Project closeout checklist","PMO / Project Management","Deliverables/checklists",Beginner,false,"Closeout|Checklist|Lessons Learned|PMO"
pat-072,pmo-change-request-lifecycle,"Change request lifecycle","PMO / Project Management","Gate approvals",Intermediate,true,"Change Request|Approvals|Scope|Governance"
pat-073,power-apps-componentized-header-pattern,"Reusable Power Apps screen header pattern","Power Apps","Form mode handling",Intermediate,false,"Components|Header|UX|Navigation"
pat-074,power-apps-accessible-status-text,"Show accessible status text with color badges","Power Apps","Role-based visibility",Beginner,false,"Accessibility|Status|UX|Badges"
pat-075,power-apps-attachment-control-guidance,"Use SharePoint attachments safely in Power Apps","Power Apps","Error handling",Intermediate,true,"Attachments|SharePoint|Document Library|Governance"
pat-076,sharepoint-external-sharing-review-pattern,"External sharing review pattern","SharePoint","Permissions and governance",Intermediate,true,"External Sharing|Permissions|Governance|Security"
pat-077,sharepoint-hub-site-content-ownership,"Assign content ownership for SharePoint hub pages","SharePoint","Site navigation patterns",Beginner,false,"Intranet|Content Ownership|Governance|Pages"
pat-078,power-automate-approval-timeout-escalation,"Escalate approvals that time out","Power Automate","Approval workflows",Advanced,true,"Approvals|Escalation|Timeout|Flow"
pat-079,power-automate-teams-notification-for-high-risk,"Send a Teams notification for high-risk items","Power Automate","Error handling",Intermediate,false,"Teams|Risks|Notification|Flow"
pat-080,pmo-benefits-realization-tracker,"Benefits realization tracker","PMO / Project Management","Executive reporting",Intermediate,true,"Benefits|Value|Executive Reporting|PMO"
pat-081,patch-a-sharepoint-yes-no-field-from-power-apps,"Patch a SharePoint yes/no field from Power Apps","Power Apps","Patch patterns",Beginner,false,"Patch|Yes No|Boolean"
pat-082,patch-a-sharepoint-currency-field,"Patch a SharePoint currency field","Power Apps","Patch patterns",Beginner,false,"Patch|Currency|Validation"
pat-083,patch-a-sharepoint-date-and-time-field,"Patch a SharePoint date and time field","Power Apps","Date handling",Intermediate,true,"Patch|Date|Time Zone"
pat-084,validate-required-fields-before-patch,"Validate required fields before Patch","Power Apps","Error handling",Beginner,false,"Validation|Patch|Notify"
pat-085,build-a-confirmation-dialog-before-destructive-actions,"Build a confirmation dialog before destructive actions","Power Apps","Modal forms",Beginner,false,"Modal|Confirmation|UX"
pat-086,create-a-reusable-loading-overlay,"Create a reusable loading overlay","Power Apps","Form mode handling",Beginner,false,"Loading|UX|Performance"
pat-087,use-named-formulas-for-app-constants,"Use named formulas for app constants","Power Apps","Collection management",Intermediate,true,"Named Formulas|Maintainability|Constants"
pat-088,cache-reference-data-on-app-start,"Cache reference data on app start","Power Apps","Collection management",Intermediate,false,"Cache|Collections|Reference Data"
pat-089,reset-form-controls-after-cancel,"Reset form controls after cancel","Power Apps","Form mode handling",Beginner,false,"ResetForm|Cancel|Forms"
pat-090,use-a-context-variable-for-screen-level-edit-state,"Use a context variable for screen-level edit state","Power Apps","Form mode handling",Intermediate,true,"Context Variables|Edit State|UX"
pat-091,create-a-reusable-notification-pattern,"Create a reusable notification pattern","Power Apps","Error handling",Beginner,false,"Notify|UX|Error Handling"
pat-092,filter-galleries-by-current-user,"Filter galleries by current user","Power Apps","Delegation-safe filtering",Intermediate,false,"Current User|Filter|Delegation"
pat-093,build-a-my-requests-view,"Build a My Requests view","Power Apps","Delegation-safe filtering",Beginner,false,"My Requests|Filter|Dashboard"
pat-094,create-an-admin-only-maintenance-screen,"Create an admin-only maintenance screen","Power Apps","Role-based visibility",Intermediate,true,"Admin|Roles|Maintenance"
pat-095,use-a-sharepoint-settings-list-for-app-configuration,"Use a SharePoint settings list for app configuration","Power Apps","Collection management",Advanced,true,"Settings|Configuration|SharePoint"
pat-096,build-a-reusable-approval-comments-panel,"Build a reusable approval comments panel","Power Apps","Modal forms",Intermediate,false,"Approvals|Comments|Modal"
pat-097,track-unsaved-changes-before-navigation,"Track unsaved changes before navigation","Power Apps","Form mode handling",Advanced,true,"Unsaved Changes|Navigation|UX"
pat-098,create-dependent-checklist-rows-from-a-template,"Create dependent checklist rows from a template","Power Apps","Collection management",Advanced,true,"Checklist|Templates|Child List"
pat-099,use-concat-to-summarize-selected-rows,"Use Concat to summarize selected rows","Power Apps","Collection management",Beginner,false,"Concat|Gallery|Summary"
pat-100,build-a-compact-power-apps-audit-note,"Build a compact Power Apps audit note","Power Apps","Error handling",Intermediate,false,"Audit|Patch|History"
pat-101,create-a-sharepoint-list-for-reusable-app-reference-data,"Create a SharePoint list for reusable app reference data","SharePoint","List schema design",Beginner,false,"Reference Data|List Schema|Governance"
pat-102,design-a-sharepoint-audit-history-list,"Design a SharePoint audit history list","SharePoint","List schema design",Intermediate,true,"Audit|History|Governance"
pat-103,create-a-sharepoint-environment-inventory,"Create a SharePoint environment inventory","SharePoint","Permissions and governance",Intermediate,false,"Inventory|Governance|Sites"
pat-104,document-sharepoint-list-ownership-and-support,"Document SharePoint list ownership and support","SharePoint","Permissions and governance",Beginner,false,"Ownership|Support|Governance"
pat-105,use-managed-metadata-vs-choice-fields,"Use managed metadata vs choice fields","SharePoint","List schema design",Advanced,true,"Managed Metadata|Choice|Taxonomy"
pat-106,create-a-sharepoint-project-workspace-template,"Create a SharePoint project workspace template","SharePoint","Site navigation patterns",Intermediate,false,"Project Workspace|Template|PMO"
pat-107,build-a-sharepoint-issue-list-view-set,"Build a SharePoint issue list view set","SharePoint","List schema design",Beginner,false,"Issues|Views|PMO"
pat-108,create-a-default-view-for-active-work-only,"Create a default view for active work only","SharePoint","List schema design",Beginner,false,"Views|Archive|Filter"
pat-109,govern-sharepoint-list-version-history,"Govern SharePoint list version history","SharePoint","Permissions and governance",Intermediate,true,"Version History|Governance|Audit"
pat-110,create-a-document-review-library-pattern,"Create a document review library pattern","SharePoint","Document library patterns",Intermediate,false,"Document Review|Metadata|Approvals"
pat-111,use-sharepoint-content-types-for-project-artifacts,"Use SharePoint content types for project artifacts","SharePoint","Document library patterns",Advanced,true,"Content Types|Documents|PMO"
pat-112,build-a-sharepoint-launch-readiness-checklist,"Build a SharePoint launch readiness checklist","SharePoint","Permissions and governance",Intermediate,false,"Launch|Checklist|Governance"
pat-113,create-an-intranet-page-review-workflow,"Create an intranet page review workflow","SharePoint","Site navigation patterns",Intermediate,true,"Intranet|Review|Workflow"
pat-114,build-a-sharepoint-permissions-exception-log,"Build a SharePoint permissions exception log","SharePoint","Permissions and governance",Advanced,true,"Permissions|Exception Log|Security"
pat-115,use-view-formatting-for-overdue-items,"Use view formatting for overdue items","SharePoint","JSON column formatting",Intermediate,false,"JSON Formatting|Due Date|Views"
pat-116,create-a-sharepoint-vendor-onboarding-list,"Create a SharePoint vendor onboarding list","SharePoint","List schema design",Intermediate,false,"Vendor|Onboarding|List Schema"
pat-117,create-adaptive-approval-emails,"Create adaptive approval emails","Power Automate","Email formatting",Intermediate,false,"Approvals|Email|Adaptive Content"
pat-118,send-a-digest-email-grouped-by-owner,"Send a digest email grouped by owner","Power Automate","Email formatting",Advanced,true,"Digest|Email|Owner"
pat-119,create-a-flow-run-logging-list,"Create a flow run logging list","Power Automate","Flow documentation",Intermediate,false,"Logging|Flow|Support"
pat-120,use-child-flows-for-shared-notification-logic,"Use child flows for shared notification logic","Power Automate","Flow documentation",Advanced,true,"Child Flow|Reuse|Notifications"
pat-121,build-a-scheduled-stale-item-cleanup-flow,"Build a scheduled stale item cleanup flow","Power Automate","SharePoint item updates",Intermediate,false,"Scheduled Flow|Cleanup|Archive"
pat-122,route-work-based-on-sharepoint-choice-value,"Route work based on SharePoint choice value","Power Automate","Approval workflows",Beginner,false,"Routing|Choice|Condition"
pat-123,use-switch-control-for-status-based-flow-paths,"Use switch control for status-based flow paths","Power Automate","Compose expressions",Beginner,false,"Switch|Status|Flow"
pat-124,parse-semicolon-separated-emails-into-recipients,"Parse semicolon-separated emails into recipients","Power Automate","Compose expressions",Intermediate,false,"Email|Recipients|Expressions"
pat-125,create-an-approval-audit-trail-in-sharepoint,"Create an approval audit trail in SharePoint","Power Automate","Approval workflows",Intermediate,true,"Approvals|Audit|SharePoint"
pat-126,retry-transient-sharepoint-connector-failures,"Retry transient SharePoint connector failures","Power Automate","Error handling",Advanced,true,"Retry|Error Handling|Connector"
pat-127,use-terminate-action-for-controlled-flow-failures,"Use terminate action for controlled flow failures","Power Automate","Error handling",Intermediate,false,"Terminate|Error Handling|Support"
pat-128,build-a-file-naming-standard-flow,"Build a file naming standard flow","Power Automate","SharePoint item updates",Intermediate,true,"Files|Naming|Document Library"
pat-129,notify-when-a-project-health-turns-red,"Notify when a project health turns red","Power Automate","Email formatting",Intermediate,false,"Status|Teams|PMO"
pat-130,create-monthly-portfolio-summary-emails,"Create monthly portfolio summary emails","Power Automate","Email formatting",Advanced,true,"Portfolio|Digest|Executive Reporting"
pat-131,create-a-project-charter-checklist,"Create a project charter checklist","PMO / Project Management","Deliverables/checklists",Beginner,false,"Charter|Checklist|PMO"
pat-132,define-project-sponsor-responsibilities,"Define project sponsor responsibilities","PMO / Project Management","Executive reporting",Beginner,false,"Sponsor|Governance|PMO"
pat-133,create-a-stakeholder-communication-matrix,"Create a stakeholder communication matrix","PMO / Project Management","Executive reporting",Intermediate,false,"Stakeholders|Communication|PMO"
pat-134,build-a-project-raid-review-cadence,"Build a project RAID review cadence","PMO / Project Management","Risk and issue tracking",Intermediate,false,"RAID|Cadence|Governance"
pat-135,create-a-weekly-pmo-health-review-agenda,"Create a weekly PMO health review agenda","PMO / Project Management","Status reporting",Beginner,false,"Agenda|Status Reporting|PMO"
pat-136,define-project-escalation-paths,"Define project escalation paths","PMO / Project Management","Gate approvals",Intermediate,true,"Escalation|Governance|Decisions"
pat-137,create-a-dependency-tracker-schema,"Create a dependency tracker schema","PMO / Project Management","Risk and issue tracking",Intermediate,false,"Dependencies|Schema|PMO"
pat-138,build-a-deliverable-acceptance-checklist,"Build a deliverable acceptance checklist","PMO / Project Management","Deliverables/checklists",Beginner,false,"Acceptance|Deliverables|Checklist"
pat-139,create-a-project-onboarding-checklist,"Create a project onboarding checklist","PMO / Project Management","Deliverables/checklists",Beginner,false,"Onboarding|Checklist|PMO"
pat-140,define-status-report-quality-criteria,"Define status report quality criteria","PMO / Project Management","Status reporting",Intermediate,false,"Status Reporting|Quality|PMO"
pat-141,create-executive-risk-narrative-guidance,"Create executive risk narrative guidance","PMO / Project Management","Executive reporting",Intermediate,true,"Risks|Executive Reporting|Writing"
pat-142,build-a-pmo-lessons-learned-library,"Build a PMO lessons learned library","PMO / Project Management","Deliverables/checklists",Intermediate,false,"Lessons Learned|Library|PMO"
