id,slug,title,category,subCategory,difficulty,isPremium,tags
pat-1038,configure-a-solution-aware-data-model,"Configure a solution-aware data model","Dataverse","Dataverse app foundation patterns",Intermediate,false,"Dataverse app foundation patterns|Configure|Dataverse"
pat-1039,configure-a-model-driven-app-sitemap,"Configure a model-driven app sitemap","Dataverse","Dataverse app foundation patterns",Beginner,false,"Dataverse app foundation patterns|Configure|Dataverse"
pat-1040,configure-a-sharepoint-to-dataverse-migration-path,"Configure a SharePoint-to-Dataverse migration path","Dataverse","Dataverse app foundation patterns",Advanced,true,"Dataverse app foundation patterns|Configure|Dataverse"
pat-1041,standardize-a-dataverse-table-naming-standard,"Standardize a Dataverse table naming standard","Dataverse","Dataverse app foundation patterns",Intermediate,true,"Dataverse app foundation patterns|Standardize|Dataverse"
pat-1042,standardize-a-request-table-schema,"Standardize a request table schema","Dataverse","Dataverse app foundation patterns",Beginner,false,"Dataverse app foundation patterns|Standardize|Dataverse"
pat-1043,standardize-a-lookup-relationship-model,"Standardize a lookup relationship model","Dataverse","Dataverse app foundation patterns",Advanced,false,"Dataverse app foundation patterns|Standardize|Dataverse"
pat-1044,standardize-a-choice-column-strategy,"Standardize a choice column strategy","Dataverse","Dataverse app foundation patterns",Beginner,false,"Dataverse app foundation patterns|Standardize|Dataverse"
pat-1045,standardize-a-business-rule-checklist,"Standardize a business rule checklist","Dataverse","Dataverse app foundation patterns",Intermediate,true,"Dataverse app foundation patterns|Standardize|Dataverse"
pat-1046,standardize-a-security-role-matrix,"Standardize a security role matrix","Dataverse","Dataverse app foundation patterns",Beginner,false,"Dataverse app foundation patterns|Standardize|Dataverse"
pat-1047,standardize-an-environment-variable-register,"Standardize an environment variable register","Dataverse","Dataverse app foundation patterns",Intermediate,false,"Dataverse app foundation patterns|Standardize|Dataverse"
pat-1048,standardize-a-solution-aware-data-model,"Standardize a solution-aware data model","Dataverse","Dataverse app foundation patterns",Beginner,false,"Dataverse app foundation patterns|Standardize|Dataverse"
pat-1049,standardize-a-model-driven-app-sitemap,"Standardize a model-driven app sitemap","Dataverse","Dataverse app foundation patterns",Advanced,true,"Dataverse app foundation patterns|Standardize|Dataverse"
pat-1050,standardize-a-sharepoint-to-dataverse-migration-path,"Standardize a SharePoint-to-Dataverse migration path","Dataverse","Dataverse app foundation patterns",Beginner,false,"Dataverse app foundation patterns|Standardize|Dataverse"
pat-1051,validate-a-dataverse-table-naming-standard,"Validate a Dataverse table naming standard","Dataverse","Dataverse app foundation patterns",Beginner,false,"Dataverse app foundation patterns|Validate|Dataverse"
pat-1052,validate-a-request-table-schema,"Validate a request table schema","Dataverse","Dataverse app foundation patterns",Advanced,false,"Dataverse app foundation patterns|Validate|Dataverse"
pat-1053,validate-a-lookup-relationship-model,"Validate a lookup relationship model","Dataverse","Dataverse app foundation patterns",Beginner,false,"Dataverse app foundation patterns|Validate|Dataverse"
pat-1054,validate-a-choice-column-strategy,"Validate a choice column strategy","Dataverse","Dataverse app foundation patterns",Intermediate,true,"Dataverse app foundation patterns|Validate|Dataverse"
pat-1055,validate-a-business-rule-checklist,"Validate a business rule checklist","Dataverse","Dataverse app foundation patterns",Beginner,false,"Dataverse app foundation patterns|Validate|Dataverse"
pat-1056,validate-a-security-role-matrix,"Validate a security role matrix","Dataverse","Dataverse app foundation patterns",Intermediate,false,"Dataverse app foundation patterns|Validate|Dataverse"
pat-1057,validate-an-environment-variable-register,"Validate an environment variable register","Dataverse","Dataverse app foundation patterns",Beginner,false,"Dataverse app foundation patterns|Validate|Dataverse"
pat-1058,validate-a-solution-aware-data-model,"Validate a solution-aware data model","Dataverse","Dataverse app foundation patterns",Advanced,true,"Dataverse app foundation patterns|Validate|Dataverse"
pat-1059,validate-a-model-driven-app-sitemap,"Validate a model-driven app sitemap","Dataverse","Dataverse app foundation patterns",Beginner,false,"Dataverse app foundation patterns|Validate|Dataverse"
pat-1060,validate-a-sharepoint-to-dataverse-migration-path,"Validate a SharePoint-to-Dataverse migration path","Dataverse","Dataverse app foundation patterns",Intermediate,false,"Dataverse app foundation patterns|Validate|Dataverse"
pat-1061,document-a-dataverse-table-naming-standard,"Document a Dataverse table naming standard","Dataverse","Dataverse app foundation patterns",Advanced,false,"Dataverse app foundation patterns|Document|Dataverse"
pat-1062,document-a-request-table-schema,"Document a request table schema","Dataverse","Dataverse app foundation patterns",Beginner,false,"Dataverse app foundation patterns|Document|Dataverse"
pat-1063,document-a-lookup-relationship-model,"Document a lookup relationship model","Dataverse","Dataverse app foundation patterns",Intermediate,true,"Dataverse app foundation patterns|Document|Dataverse"
pat-1064,document-a-choice-column-strategy,"Document a choice column strategy","Dataverse","Dataverse app foundation patterns",Beginner,false,"Dataverse app foundation patterns|Document|Dataverse"
pat-1065,document-a-business-rule-checklist,"Document a business rule checklist","Dataverse","Dataverse app foundation patterns",Intermediate,false,"Dataverse app foundation patterns|Document|Dataverse"
pat-1066,document-a-security-role-matrix,"Document a security role matrix","Dataverse","Dataverse app foundation patterns",Beginner,false,"Dataverse app foundation patterns|Document|Dataverse"
pat-1067,document-an-environment-variable-register,"Document an environment variable register","Dataverse","Dataverse app foundation patterns",Advanced,true,"Dataverse app foundation patterns|Document|Dataverse"
pat-1068,document-a-solution-aware-data-model,"Document a solution-aware data model","Dataverse","Dataverse app foundation patterns",Beginner,false,"Dataverse app foundation patterns|Document|Dataverse"
pat-1069,document-a-model-driven-app-sitemap,"Document a model-driven app sitemap","Dataverse","Dataverse app foundation patterns",Intermediate,false,"Dataverse app foundation patterns|Document|Dataverse"
pat-1070,document-a-sharepoint-to-dataverse-migration-path,"Document a SharePoint-to-Dataverse migration path","Dataverse","Dataverse app foundation patterns",Beginner,false,"Dataverse app foundation patterns|Document|Dataverse"
pat-1071,optimize-a-dataverse-table-naming-standard,"Optimize a Dataverse table naming standard","Dataverse","Dataverse app foundation patterns",Beginner,false,"Dataverse app foundation patterns|Optimize|Dataverse"
pat-1072,optimize-a-request-table-schema,"Optimize a request table schema","Dataverse","Dataverse app foundation patterns",Intermediate,true,"Dataverse app foundation patterns|Optimize|Dataverse"
pat-1073,optimize-a-lookup-relationship-model,"Optimize a lookup relationship model","Dataverse","Dataverse app foundation patterns",Beginner,false,"Dataverse app foundation patterns|Optimize|Dataverse"
pat-1074,optimize-a-choice-column-strategy,"Optimize a choice column strategy","Dataverse","Dataverse app foundation patterns",Intermediate,false,"Dataverse app foundation patterns|Optimize|Dataverse"
pat-1075,optimize-a-business-rule-checklist,"Optimize a business rule checklist","Dataverse","Dataverse app foundation patterns",Beginner,false,"Dataverse app foundation patterns|Optimize|Dataverse"
pat-1076,optimize-a-security-role-matrix,"Optimize a security role matrix","Dataverse","Dataverse app foundation patterns",Advanced,true,"Dataverse app foundation patterns|Optimize|Dataverse"
pat-1077,optimize-an-environment-variable-register,"Optimize an environment variable register","Dataverse","Dataverse app foundation patterns",Beginner,false,"Dataverse app foundation patterns|Optimize|Dataverse"
pat-1078,optimize-a-solution-aware-data-model,"Optimize a solution-aware data model","Dataverse","Dataverse app foundation patterns",Intermediate,false,"Dataverse app foundation patterns|Optimize|Dataverse"
pat-1079,optimize-a-model-driven-app-sitemap,"Optimize a model-driven app sitemap","Dataverse","Dataverse app foundation patterns",Beginner,false,"Dataverse app foundation patterns|Optimize|Dataverse"
pat-1080,optimize-a-sharepoint-to-dataverse-migration-path,"Optimize a SharePoint-to-Dataverse migration path","Dataverse","Dataverse app foundation patterns",Intermediate,true,"Dataverse app foundation patterns|Optimize|Dataverse"
pat-1081,troubleshoot-a-dataverse-table-naming-standard,"Troubleshoot a Dataverse table naming standard","Dataverse","Dataverse app foundation patterns",Intermediate,true,"Dataverse app foundation patterns|Troubleshoot|Dataverse"
pat-1082,troubleshoot-a-request-table-schema,"Troubleshoot a request table schema","Dataverse","Dataverse app foundation patterns",Beginner,false,"Dataverse app foundation patterns|Troubleshoot|Dataverse"
pat-1083,troubleshoot-a-lookup-relationship-model,"Troubleshoot a lookup relationship model","Dataverse","Dataverse app foundation patterns",Intermediate,false,"Dataverse app foundation patterns|Troubleshoot|Dataverse"
pat-1084,troubleshoot-a-choice-column-strategy,"Troubleshoot a choice column strategy","Dataverse","Dataverse app foundation patterns",Beginner,false,"Dataverse app foundation patterns|Troubleshoot|Dataverse"
pat-1085,troubleshoot-a-business-rule-checklist,"Troubleshoot a business rule checklist","Dataverse","Dataverse app foundation patterns",Advanced,true,"Dataverse app foundation patterns|Troubleshoot|Dataverse"
pat-1086,troubleshoot-a-security-role-matrix,"Troubleshoot a security role matrix","Dataverse","Dataverse app foundation patterns",Beginner,false,"Dataverse app foundation patterns|Troubleshoot|Dataverse"
pat-1087,troubleshoot-an-environment-variable-register,"Troubleshoot an environment variable register","Dataverse","Dataverse app foundation patterns",Intermediate,false,"Dataverse app foundation patterns|Troubleshoot|Dataverse"
pat-1088,troubleshoot-a-solution-aware-data-model,"Troubleshoot a solution-aware data model","Dataverse","Dataverse app foundation patterns",Beginner,false,"Dataverse app foundation patterns|Troubleshoot|Dataverse"
pat-1089,troubleshoot-a-model-driven-app-sitemap,"Troubleshoot a model-driven app sitemap","Dataverse","Dataverse app foundation patterns",Intermediate,true,"Dataverse app foundation patterns|Troubleshoot|Dataverse"
pat-1090,troubleshoot-a-sharepoint-to-dataverse-migration-path,"Troubleshoot a SharePoint-to-Dataverse migration path","Dataverse","Dataverse app foundation patterns",Beginner,false,"Dataverse app foundation patterns|Troubleshoot|Dataverse"
pat-1091,govern-a-dataverse-table-naming-standard,"Govern a Dataverse table naming standard","Dataverse","Dataverse app foundation patterns",Beginner,false,"Dataverse app foundation patterns|Govern|Dataverse"
pat-1092,govern-a-request-table-schema,"Govern a request table schema","Dataverse","Dataverse app foundation patterns",Intermediate,false,"Dataverse app foundation patterns|Govern|Dataverse"
pat-1093,govern-a-lookup-relationship-model,"Govern a lookup relationship model","Dataverse","Dataverse app foundation patterns",Beginner,false,"Dataverse app foundation patterns|Govern|Dataverse"
pat-1094,govern-a-choice-column-strategy,"Govern a choice column strategy","Dataverse","Dataverse app foundation patterns",Advanced,true,"Dataverse app foundation patterns|Govern|Dataverse"
pat-1095,govern-a-business-rule-checklist,"Govern a business rule checklist","Dataverse","Dataverse app foundation patterns",Beginner,false,"Dataverse app foundation patterns|Govern|Dataverse"
pat-1096,govern-a-security-role-matrix,"Govern a security role matrix","Dataverse","Dataverse app foundation patterns",Intermediate,false,"Dataverse app foundation patterns|Govern|Dataverse"
pat-1097,govern-an-environment-variable-register,"Govern an environment variable register","Dataverse","Dataverse app foundation patterns",Beginner,false,"Dataverse app foundation patterns|Govern|Dataverse"
pat-1098,govern-a-solution-aware-data-model,"Govern a solution-aware data model","Dataverse","Dataverse app foundation patterns",Intermediate,true,"Dataverse app foundation patterns|Govern|Dataverse"
pat-1099,govern-a-model-driven-app-sitemap,"Govern a model-driven app sitemap","Dataverse","Dataverse app foundation patterns",Beginner,false,"Dataverse app foundation patterns|Govern|Dataverse"
pat-1100,govern-a-sharepoint-to-dataverse-migration-path,"Govern a SharePoint-to-Dataverse migration path","Dataverse","Dataverse app foundation patterns",Advanced,false,"Dataverse app foundation patterns|Govern|Dataverse"
pat-1101,create-a-solution-layering-checklist,"Create a solution layering checklist","ALM & Governance","Power Platform ALM patterns",Advanced,true,"Power Platform ALM patterns|Create|ALM & Governance"
pat-1102,create-an-environment-strategy-guide,"Create an environment strategy guide","ALM & Governance","Power Platform ALM patterns",Beginner,false,"Power Platform ALM patterns|Create|ALM & Governance"
pat-1103,create-a-deployment-readiness-review,"Create a deployment readiness review","ALM & Governance","Power Platform ALM patterns",Intermediate,false,"Power Platform ALM patterns|Create|ALM & Governance"
pat-1104,create-a-connection-reference-inventory,"Create a connection reference inventory","ALM & Governance","Power Platform ALM patterns",Beginner,false,"Power Platform ALM patterns|Create|ALM & Governance"
pat-1105,create-an-unmanaged-customizations-cleanup-plan,"Create an unmanaged customizations cleanup plan","ALM & Governance","Power Platform ALM patterns",Intermediate,true,"Power Platform ALM patterns|Create|ALM & Governance"
pat-1106,create-a-release-notes-template,"Create a release notes template","ALM & Governance","Power Platform ALM patterns",Beginner,false,"Power Platform ALM patterns|Create|ALM & Governance"
pat-1107,create-a-maker-handoff-package,"Create a maker handoff package","ALM & Governance","Power Platform ALM patterns",Advanced,false,"Power Platform ALM patterns|Create|ALM & Governance"
pat-1108,create-a-production-support-ownership-model,"Create a production support ownership model","ALM & Governance","Power Platform ALM patterns",Beginner,false,"Power Platform ALM patterns|Create|ALM & Governance"
pat-1109,create-a-rollback-decision-checklist,"Create a rollback decision checklist","ALM & Governance","Power Platform ALM patterns",Intermediate,true,"Power Platform ALM patterns|Create|ALM & Governance"
pat-1110,create-a-managed-solution-promotion-path,"Create a managed solution promotion path","ALM & Governance","Power Platform ALM patterns",Beginner,false,"Power Platform ALM patterns|Create|ALM & Governance"
pat-1111,build-a-solution-layering-checklist,"Build a solution layering checklist","ALM & Governance","Power Platform ALM patterns",Beginner,false,"Power Platform ALM patterns|Build|ALM & Governance"
pat-1112,build-an-environment-strategy-guide,"Build an environment strategy guide","ALM & Governance","Power Platform ALM patterns",Intermediate,false,"Power Platform ALM patterns|Build|ALM & Governance"
pat-1113,build-a-deployment-readiness-review,"Build a deployment readiness review","ALM & Governance","Power Platform ALM patterns",Beginner,false,"Power Platform ALM patterns|Build|ALM & Governance"
pat-1114,build-a-connection-reference-inventory,"Build a connection reference inventory","ALM & Governance","Power Platform ALM patterns",Intermediate,true,"Power Platform ALM patterns|Build|ALM & Governance"
pat-1115,build-an-unmanaged-customizations-cleanup-plan,"Build an unmanaged customizations cleanup plan","ALM & Governance","Power Platform ALM patterns",Beginner,false,"Power Platform ALM patterns|Build|ALM & Governance"
pat-1116,build-a-release-notes-template,"Build a release notes template","ALM & Governance","Power Platform ALM patterns",Advanced,false,"Power Platform ALM patterns|Build|ALM & Governance"
pat-1117,build-a-maker-handoff-package,"Build a maker handoff package","ALM & Governance","Power Platform ALM patterns",Beginner,false,"Power Platform ALM patterns|Build|ALM & Governance"
pat-1118,build-a-production-support-ownership-model,"Build a production support ownership model","ALM & Governance","Power Platform ALM patterns",Intermediate,true,"Power Platform ALM patterns|Build|ALM & Governance"
pat-1119,build-a-rollback-decision-checklist,"Build a rollback decision checklist","ALM & Governance","Power Platform ALM patterns",Beginner,false,"Power Platform ALM patterns|Build|ALM & Governance"
pat-1120,build-a-managed-solution-promotion-path,"Build a managed solution promotion path","ALM & Governance","Power Platform ALM patterns",Intermediate,false,"Power Platform ALM patterns|Build|ALM & Governance"
pat-1121,design-a-solution-layering-checklist,"Design a solution layering checklist","ALM & Governance","Power Platform ALM patterns",Intermediate,false,"Power Platform ALM patterns|Design|ALM & Governance"
pat-1122,design-an-environment-strategy-guide,"Design an environment strategy guide","ALM & Governance","Power Platform ALM patterns",Beginner,false,"Power Platform ALM patterns|Design|ALM & Governance"
pat-1123,design-a-deployment-readiness-review,"Design a deployment readiness review","ALM & Governance","Power Platform ALM patterns",Intermediate,true,"Power Platform ALM patterns|Design|ALM & Governance"
pat-1124,design-a-connection-reference-inventory,"Design a connection reference inventory","ALM & Governance","Power Platform ALM patterns",Beginner,false,"Power Platform ALM patterns|Design|ALM & Governance"
pat-1125,design-an-unmanaged-customizations-cleanup-plan,"Design an unmanaged customizations cleanup plan","ALM & Governance","Power Platform ALM patterns",Advanced,false,"Power Platform ALM patterns|Design|ALM & Governance"
pat-1126,design-a-release-notes-template,"Design a release notes template","ALM & Governance","Power Platform ALM patterns",Beginner,false,"Power Platform ALM patterns|Design|ALM & Governance"
pat-1127,design-a-maker-handoff-package,"Design a maker handoff package","ALM & Governance","Power Platform ALM patterns",Intermediate,true,"Power Platform ALM patterns|Design|ALM & Governance"
pat-1128,design-a-production-support-ownership-model,"Design a production support ownership model","ALM & Governance","Power Platform ALM patterns",Beginner,false,"Power Platform ALM patterns|Design|ALM & Governance"
pat-1129,design-a-rollback-decision-checklist,"Design a rollback decision checklist","ALM & Governance","Power Platform ALM patterns",Intermediate,false,"Power Platform ALM patterns|Design|ALM & Governance"
pat-1130,design-a-managed-solution-promotion-path,"Design a managed solution promotion path","ALM & Governance","Power Platform ALM patterns",Beginner,false,"Power Platform ALM patterns|Design|ALM & Governance"
pat-1131,configure-a-solution-layering-checklist,"Configure a solution layering checklist","ALM & Governance","Power Platform ALM patterns",Beginner,false,"Power Platform ALM patterns|Configure|ALM & Governance"
pat-1132,configure-an-environment-strategy-guide,"Configure an environment strategy guide","ALM & Governance","Power Platform ALM patterns",Intermediate,true,"Power Platform ALM patterns|Configure|ALM & Governance"
pat-1133,configure-a-deployment-readiness-review,"Configure a deployment readiness review","ALM & Governance","Power Platform ALM patterns",Beginner,false,"Power Platform ALM patterns|Configure|ALM & Governance"
pat-1134,configure-a-connection-reference-inventory,"Configure a connection reference inventory","ALM & Governance","Power Platform ALM patterns",Advanced,false,"Power Platform ALM patterns|Configure|ALM & Governance"
pat-1135,configure-an-unmanaged-customizations-cleanup-plan,"Configure an unmanaged customizations cleanup plan","ALM & Governance","Power Platform ALM patterns",Beginner,false,"Power Platform ALM patterns|Configure|ALM & Governance"
pat-1136,configure-a-release-notes-template,"Configure a release notes template","ALM & Governance","Power Platform ALM patterns",Intermediate,true,"Power Platform ALM patterns|Configure|ALM & Governance"
pat-1137,configure-a-maker-handoff-package,"Configure a maker handoff package","ALM & Governance","Power Platform ALM patterns",Beginner,false,"Power Platform ALM patterns|Configure|ALM & Governance"
pat-1138,configure-a-production-support-ownership-model,"Configure a production support ownership model","ALM & Governance","Power Platform ALM patterns",Intermediate,false,"Power Platform ALM patterns|Configure|ALM & Governance"
pat-1139,configure-a-rollback-decision-checklist,"Configure a rollback decision checklist","ALM & Governance","Power Platform ALM patterns",Beginner,false,"Power Platform ALM patterns|Configure|ALM & Governance"
pat-1140,configure-a-managed-solution-promotion-path,"Configure a managed solution promotion path","ALM & Governance","Power Platform ALM patterns",Advanced,true,"Power Platform ALM patterns|Configure|ALM & Governance"
pat-1141,standardize-a-solution-layering-checklist,"Standardize a solution layering checklist","ALM & Governance","Power Platform ALM patterns",Intermediate,true,"Power Platform ALM patterns|Standardize|ALM & Governance"
pat-1142,standardize-an-environment-strategy-guide,"Standardize an environment strategy guide","ALM & Governance","Power Platform ALM patterns",Beginner,false,"Power Platform ALM patterns|Standardize|ALM & Governance"
pat-1143,standardize-a-deployment-readiness-review,"Standardize a deployment readiness review","ALM & Governance","Power Platform ALM patterns",Advanced,false,"Power Platform ALM patterns|Standardize|ALM & Governance"
pat-1144,standardize-a-connection-reference-inventory,"Standardize a connection reference inventory","ALM & Governance","Power Platform ALM patterns",Beginner,false,"Power Platform ALM patterns|Standardize|ALM & Governance"
pat-1145,standardize-an-unmanaged-customizations-cleanup-plan,"Standardize an unmanaged customizations cleanup plan","ALM & Governance","Power Platform ALM patterns",Intermediate,true,"Power Platform ALM patterns|Standardize|ALM & Governance"
pat-1146,standardize-a-release-notes-template,"Standardize a release notes template","ALM & Governance","Power Platform ALM patterns",Beginner,false,"Power Platform ALM patterns|Standardize|ALM & Governance"
pat-1147,standardize-a-maker-handoff-package,"Standardize a maker handoff package","ALM & Governance","Power Platform ALM patterns",Intermediate,false,"Power Platform ALM patterns|Standardize|ALM & Governance"
pat-1148,standardize-a-production-support-ownership-model,"Standardize a production support ownership model","ALM & Governance","Power Platform ALM patterns",Beginner,false,"Power Platform ALM patterns|Standardize|ALM & Governance"
pat-1149,standardize-a-rollback-decision-checklist,"Standardize a rollback decision checklist","ALM & Governance","Power Platform ALM patterns",Advanced,true,"Power Platform ALM patterns|Standardize|ALM & Governance"
pat-1150,standardize-a-managed-solution-promotion-path,"Standardize a managed solution promotion path","ALM & Governance","Power Platform ALM patterns",Beginner,false,"Power Platform ALM patterns|Standardize|ALM & Governance"
pat-1151,validate-a-solution-layering-checklist,"Validate a solution layering checklist","ALM & Governance","Power Platform ALM patterns",Beginner,false,"Power Platform ALM patterns|Validate|ALM & Governance"
pat-1152,validate-an-environment-strategy-guide,"Validate an environment strategy guide","ALM & Governance","Power Platform ALM patterns",Advanced,false,"Power Platform ALM patterns|Validate|ALM & Governance"
pat-1153,validate-a-deployment-readiness-review,"Validate a deployment readiness review","ALM & Governance","Power Platform ALM patterns",Beginner,false,"Power Platform ALM patterns|Validate|ALM & Governance"
pat-1154,validate-a-connection-reference-inventory,"Validate a connection reference inventory","ALM & Governance","Power Platform ALM patterns",Intermediate,true,"Power Platform ALM patterns|Validate|ALM & Governance"
pat-1155,validate-an-unmanaged-customizations-cleanup-plan,"Validate an unmanaged customizations cleanup plan","ALM & Governance","Power Platform ALM patterns",Beginner,false,"Power Platform ALM patterns|Validate|ALM & Governance"
pat-1156,validate-a-release-notes-template,"Validate a release notes template","ALM & Governance","Power Platform ALM patterns",Intermediate,false,"Power Platform ALM patterns|Validate|ALM & Governance"
pat-1157,validate-a-maker-handoff-package,"Validate a maker handoff package","ALM & Governance","Power Platform ALM patterns",Beginner,false,"Power Platform ALM patterns|Validate|ALM & Governance"
pat-1158,validate-a-production-support-ownership-model,"Validate a production support ownership model","ALM & Governance","Power Platform ALM patterns",Advanced,true,"Power Platform ALM patterns|Validate|ALM & Governance"
pat-1159,validate-a-rollback-decision-checklist,"Validate a rollback decision checklist","ALM & Governance","Power Platform ALM patterns",Beginner,false,"Power Platform ALM patterns|Validate|ALM & Governance"
pat-1160,validate-a-managed-solution-promotion-path,"Validate a managed solution promotion path","ALM & Governance","Power Platform ALM patterns",Intermediate,false,"Power Platform ALM patterns|Validate|ALM & Governance"
